{
  "$schema": "https://json-schema.org/draft/2020-12/schema",
  "$id": "https://schemas.mertsgi.org/aos/v0.1/planner_routing_policy.schema.json",
  "title": "AOS Planner Routing Policy Schema",
  "type": "object",
  "required": [
    "schema_version",
    "routing_mode",
    "allow_paid_fallback",
    "allow_provider_fallback",
    "data_classification",
    "risk_routes",
    "providers"
  ],
  "additionalProperties": false,
  "properties": {
    "schema_version": {
      "type": "string",
      "pattern": "^0\\.1(\\.[0-9]+)?$"
    },
    "routing_mode": {
      "type": "string",
      "enum": ["DETERMINISTIC", "BENCHMARK"]
    },
    "allow_paid_fallback": {
      "type": "boolean"
    },
    "paid_fallback_enabled": {
      "type": "boolean"
    },
    "paid_daily_budget_usd": {
      "type": "number",
      "minimum": 0
    },
    "paid_monthly_budget_usd": {
      "type": "number",
      "minimum": 0
    },
    "allow_provider_fallback": {
      "type": "boolean"
    },
    "data_classification": {
      "type": "string",
      "enum": ["PUBLIC", "INTERNAL", "CONFIDENTIAL", "PII_SENSITIVE"]
    },
    "risk_routes": {
      "type": "object",
      "additionalProperties": false,
      "patternProperties": {
        "^R[0-9]+$": {
          "type": "object",
          "required": ["preferred_providers"],
          "additionalProperties": false,
          "properties": {
            "preferred_providers": {
              "type": "array",
              "items": { "type": "string", "minLength": 1 },
              "minItems": 1
            }
          }
        }
      }
    },
    "providers": {
      "type": "object",
      "additionalProperties": false,
      "patternProperties": {
        "^[a-z0-9_-]+$": {
          "type": "object",
          "required": [
            "provider_id",
            "model_id",
            "billing_class",
            "structured_output",
            "cloud_local",
            "enabled",
            "allowed_data_classifications"
          ],
          "additionalProperties": false,
          "properties": {
            "provider_id": {
              "type": "string",
              "minLength": 1
            },
            "model_id": {
              "type": "string",
              "minLength": 1
            },
            "credential_env_var": {
              "type": ["string", "null"]
            },
            "billing_class": {
              "type": "string",
              "enum": [
                "FREE",
                "FREE_TIER",
                "FREE_DAILY_QUOTA",
                "FREE_TRIAL",
                "LOCAL",
                "PAID",
                "UNKNOWN"
              ]
            },
            "adapter_type": {
              "type": "string"
            },
            "api_protocol": {
              "type": "string",
              "enum": ["OPENAI_CHAT_COMPLETIONS", "OPENAI_RESPONSES"]
            },
            "base_url": {
              "type": "string"
            },
            "display_name": {
              "type": "string"
            },
            "provider_console_url": {
              "type": "string"
            },
            "additional_nonsecret_env_vars": {
              "type": "array",
              "items": { "type": "string" }
            },
            "priority": {
              "type": "integer"
            },
            "capabilities": {
              "type": "array",
              "items": { "type": "string" }
            },
            "max_output_tokens": {
              "type": "integer"
            },
            "readiness_url": {
              "type": "string",
              "pattern": "^http://(?:localhost|127(?:\\.[0-9]{1,3}){3}|\\[?::1\\]?)(?::[0-9]{1,5})?/"
            },
            "readiness_timeout_seconds": {
              "type": "number",
              "minimum": 0.1,
              "maximum": 10
            },
            "upstream_commit_sha": {
              "type": "string",
              "pattern": "^[0-9a-f]{40}$"
            },
            "structured_output": {
              "type": "boolean"
            },
            "cloud_local": {
              "type": "string",
              "enum": ["CLOUD", "LOCAL"]
            },
            "enabled": {
              "type": "boolean"
            },
            "allowed_data_classifications": {
              "type": "array",
              "items": {
                "type": "string",
                "enum": ["PUBLIC", "INTERNAL", "CONFIDENTIAL", "PII_SENSITIVE"]
              },
              "minItems": 1
            },
            "model_context_tokens": {
              "type": ["integer", "null"],
              "minimum": 1024
            },
            "quality_tier": {
              "type": ["integer", "null"],
              "minimum": 1,
              "maximum": 5
            },
            "expected_latency_ms": {
              "type": ["integer", "null"],
              "minimum": 0
            },
            "scarcity_class": {
              "type": "string",
              "enum": ["NORMAL", "LIMITED", "SCARCE", "UNKNOWN"]
            }
          }
        }
      }
    },
    "extensions": {
      "type": "object",
      "additionalProperties": true
    }
  }
}
