{
  "schema_version": "0.1.0",
  "routing_mode": "DETERMINISTIC",
  "allow_paid_fallback": false,
  "allow_provider_fallback": true,
  "data_classification": "PUBLIC",
  "risk_routes": {
    "R0": {
      "preferred_providers": ["gemini", "groq"]
    }
  },
  "providers": {
    "gemini": {
      "provider_id": "gemini",
      "model_id": "gemini-3.6-flash",
      "credential_env_var": "GEMINI_API_KEY",
      "billing_class": "FREE_TIER",
      "structured_output": true,
      "cloud_local": "CLOUD",
      "enabled": true,
      "allowed_data_classifications": ["PUBLIC"]
    },
    "groq": {
      "provider_id": "groq",
      "model_id": "openai/gpt-oss-120b",
      "credential_env_var": "GROQ_API_KEY",
      "billing_class": "FREE_TIER",
      "structured_output": true,
      "cloud_local": "CLOUD",
      "enabled": true,
      "allowed_data_classifications": ["PUBLIC"]
    },
    "openai": {
      "provider_id": "openai",
      "model_id": "gpt-5.6-sol",
      "credential_env_var": "OPENAI_API_KEY",
      "billing_class": "PAID",
      "structured_output": true,
      "cloud_local": "CLOUD",
      "enabled": true,
      "allowed_data_classifications": ["PUBLIC", "INTERNAL"]
    }
  }
}
